http://bbasak.com/bbs/board.php?bo_table=b001&wr_id=2257013&sfl=wr_subject%7C%7Cwr_content&stx=g6&sop=and&page=1,170501,엘지기변은 여전한가여??,여전히 구린가요?? V20 이나 g6 어떤가영??,2017-05-01 18:10:25.161000
http://bbasak.com/bbs/board.php?bo_table=b001&wr_id=2186994&sfl=wr_subject%7C%7Cwr_content&stx=g6&sop=and&page=11,170415,S8+ 몇기가로 구매들 하시나요??,즐거운 주말 핫한 주말 되기를 바라면서.... 다들 S8+ 구매 하실떄 몇기가로 구매들 하시나요?? 64 ? 128 ? S8 은 생각지도 않고 있었는데.... 자꾸 관심이가 가네요 ㅠㅠ 128의 장점은 용량과 램 6G ? 단점은? 검정 단일인가요?,2017-05-01 18:12:09.435000
http://bbasak.com/bbs/board.php?bo_table=b001&wr_id=2186323&sfl=wr_subject%7C%7Cwr_content&stx=g6&sop=and&page=11,170415,대구 내방으로 g6 계약했습니다.,조건이 그렇게 좋지는 않았어요 케티번이 65요금제 6개월 무부 24개월선약 40징으로 계약했습니다. 대구도 잘 찾아보면 싼데 있다고 하고 스노방에서 하면 50~55징까지도 받는다곤 하는데 참을성이 없기도 하고 ㅠㅠ 아무래도 택배 거래보다는 오프라인이 안전할거 같아서 계약해버렸습니다 ㅠㅠ 출고가 - 선약 - 40징 - 톤플 = 10정도 되네요. 다 따지면 10만원도 안되는 금액에 산거니까 큰 후회는 없을거 같습니다.(제발) 다만 속쓰릴 수 있으니 빠삭은 최대한 안오는걸로 ㅠㅠ..ㅋㅋㅋ 개통은 내일오후쯤 된다고 하니 개통 후 g6 사용후기 올리도록 할게요. 지방분들 화이팅입니다.,2017-05-01 18:12:09.688000
http://bbasak.com/bbs/board.php?bo_table=b001&wr_id=2186267&sfl=wr_subject%7C%7Cwr_content&stx=g6&sop=and&page=11,170415,S8 뒤에 지문 안불편할가요,ㅇㅇ,2017-05-01 18:12:09.979000
http://bbasak.com/bbs/board.php?bo_table=b001&wr_id=2185681&sfl=wr_subject%7C%7Cwr_content&stx=g6&sop=and&page=11,170414,스크 기변 G6 언제쯤 좋게 나올까요 ㅠ,스크 기변 G6 밴디 1.2G 30 징 이던데 더이상 올라가길 바랄순 없겟지요? 원래 제가 1.2GB 요금제 사용하니 이정두면 그냥 가는게 나을까요?,2017-05-01 18:12:10.206000
http://bbasak.com/bbs/board.php?bo_table=b001&wr_id=2185436&sfl=wr_subject%7C%7Cwr_content&stx=g6&sop=and&page=11,170414,G6 vs V20 올린사람입니다 느낀점,솔직히 v20이 g6보다 6개월 빨리나왔는데도 사용자들이나 조건을 기다리는 사람한테 g6보다 매력적인 카드로 인식됐다면 lg마케팅팀은 잃어버린 6개월을 살았다고 봐도 무방할 거 같습니다.. S8의 동일 경쟁플래그쉽인데 많이 아쉽네요 아프지마 엘지 ㅠㅠ,2017-05-01 18:12:10.472000
http://bbasak.com/bbs/board.php?bo_table=b001&wr_id=2185356&sfl=wr_subject%7C%7Cwr_content&stx=g6&sop=and&page=11,170414,G6 vs V20,같은 조건이라면 뭐 타시겠어요!? 시야에 G6도 들어와서 여쭤봅니다..,2017-05-01 18:12:12.531000
http://bbasak.com/bbs/board.php?bo_table=b001&wr_id=2184778&sfl=wr_subject%7C%7Cwr_content&stx=g6&sop=and&page=11,170414,G6,G6 사용중인데 이모저모로 만족스럽네요!,2017-05-01 18:12:12.802000
http://bbasak.com/bbs/board.php?bo_table=b001&wr_id=2184565&sfl=wr_subject%7C%7Cwr_content&stx=g6&sop=and&page=12,170414,S7 G6 중에 추천 좀여~~,S8은 너무 비쌀거 같고 지프로2 사용중인데3d게임이 렉이 좀 심해서 G6나 S7중 바꾸려는데 성능이나 게임하기에 뭔 폰이 좋을까요??,2017-05-01 18:12:13.404000
http://bbasak.com/bbs/board.php?bo_table=b001&wr_id=2184536&sfl=wr_subject%7C%7Cwr_content&stx=g6&sop=and&page=12,170414,G6나S8 KT번이 요즘 조건 어떤가요??,현아로 30~40이면 구입할수 있나요?? 스노방 너무 궁금하네요;;;;;,2017-05-01 18:12:13.646000
http://bbasak.com/bbs/board.php?bo_table=b001&wr_id=2184450&sfl=wr_subject%7C%7Cwr_content&stx=g6&sop=and&page=12,170414,갤8 vs g6,뭐가나을까요?,2017-05-01 18:12:14.143000
http://bbasak.com/bbs/board.php?bo_table=b001&wr_id=2183906&sfl=wr_subject%7C%7Cwr_content&stx=g6&sop=and&page=12,170414,구매 방법 질문입니다.,징 울리는게 ㅍㅇㅂ을 의미 하는 거죠? 그럼 출고가-징 인가요? 아니면 할부원금-징 인가요? 구매시 유의사항 있나요? 혹시 kt 번이 G6 얼마쯤 하나요?,2017-05-01 18:12:14.580000
http://bbasak.com/bbs/board.php?bo_table=b001&wr_id=2183870&sfl=wr_subject%7C%7Cwr_content&stx=g6&sop=and&page=12,170414,kt g6 번이 이정도괜찮나요?,선약24개월 65?요금제 6개월유지 무부 44~45징 정도 받을거 같습니다,2017-05-01 18:12:14.855000
http://bbasak.com/bbs/board.php?bo_table=b001&wr_id=2183461&sfl=wr_subject%7C%7Cwr_content&stx=g6&sop=and&page=12,170414,선약 현아구매시 계산 이렇게하는거 맞나요?,출고 - ㄲㄷㅂ = 내가 낼 금액 선약할인은 요금제에서 돌려받는것 예를들어 g6 50징이면 90-50해서 현아 40을 현금으로 내고 선약은 요금에서할인 맞나옹?,2017-05-01 18:12:15.182000
http://bbasak.com/bbs/board.php?bo_table=b001&wr_id=2183319&sfl=wr_subject%7C%7Cwr_content&stx=g6&sop=and&page=12,170414,지금 Kt g6 번이는 어때요??,기변은 조건 좋은거 같던뎅...,2017-05-01 18:12:15.464000
http://bbasak.com/bbs/board.php?bo_table=b001&wr_id=2183175&sfl=wr_subject%7C%7Cwr_content&stx=g6&sop=and&page=12,170414,G6 KT기변 요즘 가격 어떤가요..?,동생 폰이 망가져서... 가격대가 어느정도인가요?,2017-05-01 18:12:15.809000
http://bbasak.com/bbs/board.php?bo_table=b001&wr_id=2183084&sfl=wr_subject%7C%7Cwr_content&stx=g6&sop=and&page=12,170414,Kt 기변은 머가좋은가요?,Kt 기변할만한게 어떤게있나요?,2017-05-01 18:12:17.563000
http://bbasak.com/bbs/board.php?bo_table=b001&wr_id=2183023&sfl=wr_subject%7C%7Cwr_content&stx=g6&sop=and&page=12,170414,g6 ㅋㅌㄱㅂ 이정도면 괜찮나요?,요금제 69 현아34(카드 10만원 실적채우면 26) 부× 스노방 기다리고 있다가 아는분이 소개해셔서 이걸로 갈까하는데....이정도면 괜찮죠?,2017-05-01 18:12:17.960000
http://bbasak.com/bbs/board.php?bo_table=b001&wr_id=2183014&sfl=wr_subject%7C%7Cwr_content&stx=g6&sop=and&page=12,170414,얀덱스 브라우저 엄청 빠르네요,g6로 바꾸고 브라우저 찾다가 얀덱스알파+에드가드 광고제거 앱쓰는데 어떤브라우저보다 빠르네요 구글플레이에서 둘다 다운가능합니다,2017-05-01 18:12:18.209000
http://bbasak.com/bbs/board.php?bo_table=b001&wr_id=2182989&sfl=wr_subject%7C%7Cwr_content&stx=g6&sop=and&page=12,170414,유플 기변 g6 이정도면?,유플 기변 45징이 아닌 현완 42만인데요 현완으로 이거 괜찮은건가요? 59요금제 6개월 유지 부가 X이고 다음주에도 더 좋은게 뜰련지요?,2017-05-01 18:12:18.437000
http://bbasak.com/bbs/board.php?bo_table=b001&wr_id=2182637&sfl=wr_subject%7C%7Cwr_content&stx=g6&sop=and&page=12,170414,Kt 번이 g6  어떻게되요?,기버ㆍ이 63징? 버ㆍ이는어떤가요?,2017-05-01 18:12:18.668000
http://bbasak.com/bbs/board.php?bo_table=b001&wr_id=2182523&sfl=wr_subject%7C%7Cwr_content&stx=g6&sop=and&page=12,170414,ㅋㅌ ㄱㅂ  g6 대박이네요,53징 대박 별포이트 사용가능 완전 대박아닌가요 54 요금제에 아닌가요 별포인트 얼마까지 사용가능한가는 모르지만 대박아닌가요,2017-05-01 18:12:19.064000
http://bbasak.com/bbs/board.php?bo_table=b001&wr_id=2182438&sfl=wr_subject%7C%7Cwr_content&stx=g6&sop=and&page=12,170414,g6  조건이 그렇게 좋나요??,아 빨리 스노방 드러가고 싶네요,2017-05-01 18:12:19.364000
http://bbasak.com/bbs/board.php?bo_table=b001&wr_id=2182404&sfl=wr_subject%7C%7Cwr_content&stx=g6&sop=and&page=12,170414,kt 빵빵 터지네요 ㅠ,빵빵 터지네요. 유예가 25일 남은시점에서 속쓰려요 ㅠㅠㅠ,2017-05-01 18:12:19.758000
http://bbasak.com/bbs/board.php?bo_table=b001&wr_id=2182072&sfl=wr_subject%7C%7Cwr_content&stx=g6&sop=and&page=12,170414,LG기변 G6 or V20 선택은?,오늘 드디어 LG 기변이 떴어요. G6 - 42징 V20 - 37징 어떤걸 선택해야 후회를 안 할까요? G6은 사은품도 주는데.... 여러분의 선택은?,2017-05-01 18:12:20.293000
http://bbasak.com/bbs/board.php?bo_table=b001&wr_id=2181381&sfl=wr_subject%7C%7Cwr_content&stx=g6&sop=and&page=12,170414,V20 64징,통신사 관계없이 최근에 V20 64징 나왔다는데요 혹시 판매자 좌표나 아이디 알 수있을까요? 공개힘드시면 쪽지라도 주세요... v20이랑 g6 중 선택고민중입니다.,2017-05-01 18:12:20.613000
http://bbasak.com/bbs/board.php?bo_table=b001&wr_id=2181350&sfl=wr_subject%7C%7Cwr_content&stx=g6&sop=and&page=12,170414,오늘 g6 케티번이 날씨 어떤가요~?,날씨 좋으면 지방이지만 발품 좀 팔아볼려구요ㅠㅠ,2017-05-01 18:12:20.857000
http://bbasak.com/bbs/board.php?bo_table=b001&wr_id=2181124&sfl=wr_subject%7C%7Cwr_content&stx=g6&sop=and&page=12,170414,V20이진리죠,이제 타려고합니다 언제뜨나요,2017-05-01 18:12:21.099000
http://bbasak.com/bbs/board.php?bo_table=b001&wr_id=2181030&sfl=wr_subject%7C%7Cwr_content&stx=g6&sop=and&page=12,170414,유플은 같은 엘지인 g6 랑 스마트워치 홍보는 안하고,허구한날 아이폰이랑 겔럭시만 홍보하나 유플에서 G6 사려해도 아무런 메리트가 없네요 역시 핸폰은 스크로 가야하나요,2017-05-01 18:12:22.504000
http://bbasak.com/bbs/board.php?bo_table=b001&wr_id=2181018&sfl=wr_subject%7C%7Cwr_content&stx=g6&sop=and&page=12,170414,못참고  강변 가봅니다,어제 가입해서. . . 스크기변 날씨좀 알려주세요 기변은 강변도 괜찮다고 해서 버스 타고 지금 가는중입니다 g6 s7 v20 생각중 입니다,2017-05-01 18:12:22.762000
http://bbasak.com/bbs/board.php?bo_table=b001&wr_id=2180594&sfl=wr_subject%7C%7Cwr_content&stx=g6&sop=and&page=12,170414,LGU 기변 스노방 현재,갤8+ 사고싶은데 카드사관련 할인 20까지는 있는데 이걸로 가야할지 아님 스노방 G6가 37징 있네요 고민되네요... 사고싶은건 갤8+인데 가격부담이 ;;,2017-05-01 18:12:23.069000
http://bbasak.com/bbs/board.php?bo_table=b001&wr_id=2180474&sfl=wr_subject%7C%7Cwr_content&stx=g6&sop=and&page=12,170414,V20 또 기다립니다.,글 봤었는데 sk 번이라서 ㅜㅜ 다른 통신사는 뭐하는지 모르겠네요.,2017-05-01 18:12:23.388000
http://bbasak.com/bbs/board.php?bo_table=b001&wr_id=2180432&sfl=wr_subject%7C%7Cwr_content&stx=g6&sop=and&page=12,170414,엘지 기변좀 잘 뜨면 좋겟네요,엘지 기변 g6 v20 제발,2017-05-01 18:12:23.650000
http://bbasak.com/bbs/board.php?bo_table=b001&wr_id=2179946&sfl=wr_subject%7C%7Cwr_content&stx=g6&sop=and&page=12,170414,V20 사야겠네요,가계에 도움을 줘야겠어요,2017-05-01 18:12:23.992000
http://bbasak.com/bbs/board.php?bo_table=b001&wr_id=2179870&sfl=wr_subject%7C%7Cwr_content&stx=g6&sop=and&page=12,170414,G6 뽐 좀 죽여주세요ㅜㅜ,하.. 시간들여서 장문으로 글 쓰는중이였는데 실수로 모두닫기 눌러버렸습니다.. 다시 쓰기에는 너무 귀찮아서 간략하게 씁니다. 현재 갤7 사용중입니다. 작년6월에 졸업해서 위약금 17만원 남았네요. 지금껏 새 폰을 사면 최소2년반은 채웠었는데 이런게 기변증인지 G6가 너무 탐나네요. 2년은 채우고 바꿔야지 라는 생각을 하다가도 옆동네에서 관련 글이나 찾아보고있고.. 일상생활에 지장이 생길것만 같습니다. 혼자 아무리 단점만 꼽아서 생각해도 정말 하나도 빠짐없이 반박이 되서 뽐이 죽질 않네요. 도와주세요ㅜ 미치겠습니다 사소한거라도 좋으니 단점만 골라서 댓글써주시면 감사하겠습니다,2017-05-01 18:12:24.415000
http://bbasak.com/bbs/board.php?bo_table=b001&wr_id=2179695&sfl=wr_subject%7C%7Cwr_content&stx=g6&sop=and&page=12,170414,요금제 저렴한 폰 없을까요?,부모님폰이 오래되서 바꿀려고 하는데 요금제가 비싸서 안 바꾸실려고 하시네요 3만원대요금제 가능한 폰이 있을까요? 스크나 르그로 번이 할 생각입니다.,2017-05-01 18:12:24.715000
http://bbasak.com/bbs/board.php?bo_table=b001&wr_id=2179667&sfl=wr_subject%7C%7Cwr_content&stx=g6&sop=and&page=12,170414,G5 어떤가요??,어차피 카톡 인터넷 통화 캐주얼게임 말고는 안하는데 잘사용하던 지프로2가 말을 안들어서 그냥저렴한걸로 바꿀라고하는데 G5쓰시는분들 어떤가요??,2017-05-01 18:12:24.979000
http://bbasak.com/bbs/board.php?bo_table=b001&wr_id=2179610&sfl=wr_subject%7C%7Cwr_content&stx=g6&sop=and&page=12,170414,일체형때문에 고민했지만 g6을 사기로 결심,s8은 실제로 보니까 엣지가 영 별로더라구요....v30까지 기다려볼까 하다가 그것도 일체형으로 안나온단 보장이 없어서 걍 g6으로 갈까합니다ㅠㅠ,2017-05-01 18:12:25.256000
http://bbasak.com/bbs/board.php?bo_table=b001&wr_id=2179599&sfl=wr_subject%7C%7Cwr_content&stx=g6&sop=and&page=13,170414,v20 음질이 진짜 대단하네요.. 깜짝 놀랄정도로..,어제 스크 번이 v20 타서 계속 만지면서 놀고 있는데.. 음질이 정말 대단합니다.. 놀랄정도로 저는 노트3를 썻었고 노트3로는 음악을 거의 안들었어요.. 사실 좋은 소리란게 뭔지 몰랐는데 노트3랑 v20이랑 비교하면서 듣는데 32비트 소리란게 체감이 갑니다... 어반 자카파 노래 듣고 있는데 mp3로 무손실 음원도 아닌데 노트3는 듣고 있으면 뭔가 막힌것 같고 스트레스가 쌓이는데 그래서 음악감상하는 느낌이 안나는데 v20으로 듣고 있으면 시원하고 슬픈노래를 들으면 슬프고 신나는 노래를 들으면 신나네요 어떻게 똑같은 파일이 이렇게 차이가 날수 있는지 놀랄정도에요 정말 좋아요 삼성쓰다가 엘지 쓰니까 어색한건 있는데 솔직히 엘지가 더 편하고 눈도 덜피곤하네요 v20만지다고 노트5만져봤는데 터치감이나 화면넘어가는것도 v20이 훨 낫습니다 진짜 핸드폰 좋고 잘만들었어요 이런걸 공짜폰으로 구할수 있다니 ㅎㅎ 너무 기분이 좋네요 진짜 빠삭에 가입해서 눈팅한 보람을 톡톡히 했습니다 오늘 가족 폰도 같은것으로 태워줬는데 정말 잘한거 같아요,2017-05-01 18:12:26.669000
http://bbasak.com/bbs/board.php?bo_table=b001&wr_id=2179382&sfl=wr_subject%7C%7Cwr_content&stx=g6&sop=and&page=13,170413,S7엣지 vs G6 선택은?..,S8+만 바라보다가 가격의 벽에 포기하고 G6로 눈을 돌렸는데 커뮤 보면 볼수록 자꾸 S7엣지에 눈이 가네요 ㅋㅋ 각자 장점이 있지만 비슷한 스펙인데 S7쪽이 최적화가 잘되있다는 얘기가 보이네용. G6의 장점은 액정크기 베젤리스디자인 음질 광각 카메라 정도일거고 S7엣지는 비슷한 스펙이지만 조금 더 저렴한 가격 물리 버튼 정도가 있겠네용 (맞나요?ㅋㅋ) 일단 저는 비슷한 가격이면 G6로 가고 싶은 마음인데 또 가성비를 따지자니 S7엣지 쪽이 지금 가격이 괜찮다고 하던데.. 뭐 아직 스노방 출입이 안되서 정확히는 모르겠지만요 ㅋㅋ 비슷한 가격이라면 어느쪽으로 가실건가요~?,2017-05-01 18:12:28.552000
http://bbasak.com/bbs/board.php?bo_table=b001&wr_id=2179320&sfl=wr_subject%7C%7Cwr_content&stx=g6&sop=and&page=13,170413,g6 퀵차지에대해서 (나만그런가?),뭐 퀵차지 3.0뭐시기 달았다고하는데 체감상 뭐가 퀵차지인지 모르겠음 10분충전에 5%차던데 나만 느끼는건가요??,2017-05-01 18:12:30.160000
http://bbasak.com/bbs/board.php?bo_table=b001&wr_id=2179300&sfl=wr_subject%7C%7Cwr_content&stx=g6&sop=and&page=13,170413,KT S7이나 G6  S8 번이 요즘 어떤가요??,스노방인증이 안되서 판매조건이 어떤지 모르겠네요~ KT번이 요즘 어떤가요?? 셋중에 하나 타고 싶은데~~~,2017-05-01 18:12:32.421000
http://bbasak.com/bbs/board.php?bo_table=b001&wr_id=2179268&sfl=wr_subject%7C%7Cwr_content&stx=g6&sop=and&page=13,170413,Gpro2에서 넘어가려고 합니다~,3D게임폰으로 뭐가 좋을까요?? 화면이 크면 렉이 심하지 않을까요??? S7이면 충분할지~ S8이나 G6가 더 나을까요??,2017-05-01 18:12:32.697000
http://bbasak.com/bbs/board.php?bo_table=b001&wr_id=2179212&sfl=wr_subject%7C%7Cwr_content&stx=g6&sop=and&page=13,170413,KT 무진장 뿌리네요 ㅎㅎ G6 기변이,30 만원 이네요 ㅎㅎ ...... 기변이니 별포인트 쓰면 26 만원까지 떨어지네요.... 이렇게되면 V20 공시 혹은 선약으로 KT 번호이동으로 구매하는것보다 G6 로 선택약정 구매하는게 더 저렴해지는 결과를 가져오네요 ㅎㅎ 물론 658 요금제만 쓰시는 분 기준이긴하지만 ㅋㅋ KT 가 플래그쉽 기종에 리베이트 뿌려서 우량가입자 모을려고 작정한것 같습니다. ㅎㅎ P.S : 현재 KT S8 보다 기변가로 13 만원 싼건데 예판 사은품을 생각해볼때 차후 중고값까지 고려하면 저래 뿌려도 예판 KT S8 이 더 좋아 보이긴합니다.,2017-05-01 18:12:33.055000
http://bbasak.com/bbs/board.php?bo_table=b001&wr_id=2178744&sfl=wr_subject%7C%7Cwr_content&stx=g6&sop=and&page=13,170413,밴드 점점 짜증나네요,페이백 불법적인거고 업자분들도 신중하신건 알겠는데 밴드 가입신청해서 가입했더니 추가 인증 하라그러고 추가 인증했더니 얼척없는 조건들이 대다수고 보조금 가능한지 조차 1:1 대화로 안내안된다고 하면서 내방 하래서 갔더니 저희는 보조금 없는데요 이러구 있구 스트레스 터지네요 신분증까지 확인해서 인증받았으면 좀 제대로 조건걸고 서로 윈윈하면 될텐데 왜이러는 걸까요 진짜. 단통법 때문에 서로 힘든것도 알고 ㅍㅇㅂ을 바라는게 옳다는건 아니지만 너무 아니다 싶네요... 직업적으로 욕하는거 싫은데 이래서 폰팔이 폰팔이 하는건지...,2017-05-01 18:12:33.517000
http://bbasak.com/bbs/board.php?bo_table=b001&wr_id=2178506&sfl=wr_subject%7C%7Cwr_content&stx=g6&sop=and&page=13,170413,할부도 ㄲㄷㅂ40징이상 나오나요 ?,현아폰만 나오죠 ?,2017-05-01 18:12:33.834000
http://bbasak.com/bbs/board.php?bo_table=b001&wr_id=2178412&sfl=wr_subject%7C%7Cwr_content&stx=g6&sop=and&page=13,170413,ㅅㅋ g6 징 좋네요. 1년됐는데 ㄱㅂ 되나요?,지금 보니깐 진짜 좋은거 같네요 공시로 1년정도 됐는데 기변하면 위약 내야하나요? 유예는 6개월 남아있어야만 유예되는건가요? ㅋㅌ 입니다. 생각지도않게 기변증이 오고있습니다. 아. 공시로 6개월 지난다음에 요금제변경할때 혹시 표준요금으로 바꿔도 공시반환 안하나요? 표준말고는 저려미가 없는거 같아서요.,2017-05-01 18:12:34.579000
http://bbasak.com/bbs/board.php?bo_table=b001&wr_id=2177599&sfl=wr_subject%7C%7Cwr_content&stx=g6&sop=and&page=13,170413,ㅅㄴㅂ LG번이 g6 나 v20 괜찮나요??,g6  v20 50징인데 괜찮은건가요? 현재 SK쓰고있습니다,2017-05-01 18:12:34.819000
http://bbasak.com/bbs/board.php?bo_table=b001&wr_id=2177060&sfl=wr_subject%7C%7Cwr_content&stx=g6&sop=and&page=13,170413,c 타입 먼가 불편해요 ...ㅎㅎ,으아~~ .. 벌써 c젠더 3번째 분실 하네요 .... 이번에 g6 넘어 오면서 c타입으로 바겨서 젠더로 사용중인데 벌써 3번 이나 분실 했어요 .. 그래서 그냥 케이블을 구매했어요 ㅜㅜ,2017-05-01 18:12:35.045000
http://bbasak.com/bbs/board.php?bo_table=b001&wr_id=2176880&sfl=wr_subject%7C%7Cwr_content&stx=g6&sop=and&page=13,170413,2주뒤에도 lg폰들이 지금같은 조건이 나올까요?ㅠㅠ,15일 제한때문에 꼼짝없이 12일은 더 기다려야해요. 지금 v20 g6 조건 좋다는 글볼때마다 아쉽고 초조하고 그래요.ㅠㅠ 싸게 풀리는 이유가 s8 예판때문이라고 들었거든요. s8 예판이 18일에 끝나는걸로 아는데.. 그때 이후면 lg폰이 출혈하면서까지 싸게 내놓을 이유가 없지 않나요? 2주뒤에 기껏 스노방가도 정책이 없으면.. 또 몇개월 기다려야할까요ㅠㅠ,2017-05-01 18:12:35.703000
http://bbasak.com/bbs/board.php?bo_table=b001&wr_id=2176310&sfl=wr_subject%7C%7Cwr_content&stx=g6&sop=and&page=13,170413,지방민인데 그냥 서울에 올라가보면 될까요?,ㅅㄴㅂ 입장 캐시는 하루치밖에 없고 일단 서울에 올라가서 ㅅㄴㅂ 입장권을 사서 알아볼까요 KT 기변으로 G6 하고 싶었는데 너무 비싼거 같아서 공시지원금 오른 V20 노리고 있는데 캐시가 넉넉하지 않아서 골때리네요 ㅠ_ㅠ 좀 비싸도 제것만 하면 그냥 지방에서 하겠는데 어머니꺼까지 해야하니 더 곤란한..지방민은 웁니다.,2017-05-01 18:12:36.069000
http://bbasak.com/bbs/board.php?bo_table=b001&wr_id=2176125&sfl=wr_subject%7C%7Cwr_content&stx=g6&sop=and&page=13,170413,현재 같은가격이면 v20 g6 어떤게 나을까요?,사은품까지 생각하면 g6이 좋을까요?,2017-05-01 18:12:37.573000
http://bbasak.com/bbs/board.php?bo_table=b001&wr_id=2175790&sfl=wr_subject%7C%7Cwr_content&stx=g6&sop=and&page=13,170413,오늘도 v20 달리네요 굿굿,g6도 60징 웬지 곧 뜰거같은데 s8때문에,2017-05-01 18:12:37.996000
http://bbasak.com/bbs/board.php?bo_table=b001&wr_id=2175494&sfl=wr_subject%7C%7Cwr_content&stx=g6&sop=and&page=13,170413,아 v20.... 지금 젤 싼게,lg 번이로 오징어 있네요. g6도 오징어고... 타야되나 말아야돼나... 타면 뭘 타야되나... v20이냐 g6냐.. 가격은 공시지원금이 v20이 많아서 10만원 정도 싼데... 여러분의 선택은?,2017-05-01 18:12:38.405000
http://bbasak.com/bbs/board.php?bo_table=b001&wr_id=2175265&sfl=wr_subject%7C%7Cwr_content&stx=g6&sop=and&page=13,170413,g6 색상 추천 부탁드립니다.,화이트랑 메탈 중 고민 중입니다.. 무난한 화이트가 좋을까요?,2017-05-01 18:12:38.706000
http://bbasak.com/bbs/board.php?bo_table=b001&wr_id=2175019&sfl=wr_subject%7C%7Cwr_content&stx=g6&sop=and&page=13,170413,v20랑 g6랑 크기빼고는 큰 차이없는 것 같은데..,음질도 옆그레이드라고 하고 오히려 브이공이 탈착식이고 화면넓어서 메리트있는데 쥐6이 최근폰이라는게 메리트인가...,2017-05-01 18:12:39.047000
http://bbasak.com/bbs/board.php?bo_table=b001&wr_id=2173620&sfl=wr_subject%7C%7Cwr_content&stx=g6&sop=and&page=13,170413,S8 정말 땡기네요..,G2 -g3-g5 그 동안 썼습니다. 딱히 삼성이 싫어서라기보다는 약간 동정심에 엘지를 그 동안 썼었고. (가성비도 좋고) 앞으로도 계속 엘지 쓸 생각이었는ㄷs8 만지고 오니깐 정말 혹하네요; 덱스도 땡기고요,2017-05-01 18:12:39.883000
http://bbasak.com/bbs/board.php?bo_table=b001&wr_id=2173472&sfl=wr_subject%7C%7Cwr_content&stx=g6&sop=and&page=13,170412,ㅅㅋㅂㅇ g6 지금 가겨좋은거같네요,아... 내가 ㅅㅋ만 아니엿어도 바로탈텐데,2017-05-01 18:12:41.417000
http://bbasak.com/bbs/board.php?bo_table=b001&wr_id=2172934&sfl=wr_subject%7C%7Cwr_content&stx=g6&sop=and&page=13,170412,사운드쪽으로 뛰어난 스마트폰은 v20인가요?,,2017-05-01 18:12:41.695000
http://bbasak.com/bbs/board.php?bo_table=b001&wr_id=2172788&sfl=wr_subject%7C%7Cwr_content&stx=g6&sop=and&page=13,170412,스노방 스크기변 G6 괜찮은건가요?,스크기변 징 35 가격 괜찮나요!?,2017-05-01 18:12:41.969000
http://bbasak.com/bbs/board.php?bo_table=b001&wr_id=2172096&sfl=wr_subject%7C%7Cwr_content&stx=g6&sop=and&page=13,170412,G6  ㅋㅌㅂㅇ 어떤가요,데이터 658 6개월유지 현금완납 28 어떤가요.. G6도 무한부팅...등 1년지나면 뻘짓하려나...,2017-05-01 18:12:42.244000
http://bbasak.com/bbs/board.php?bo_table=b001&wr_id=2171762&sfl=wr_subject%7C%7Cwr_content&stx=g6&sop=and&page=13,170412,G6 이정도면 탈만 한가요?,G6 LG기변 25ㅍㅇㅂ 선약가능 이정도면 탈만 한가요? 599요금제 쓸거라 25에 선약이면 나쁘지 않아 보이긴 하는데.... 어떤가요?,2017-05-01 18:12:42.619000
http://bbasak.com/bbs/board.php?bo_table=b001&wr_id=2170223&sfl=wr_subject%7C%7Cwr_content&stx=g6&sop=and&page=13,170412,S8 VS G6 여러분의 선택은?,S8은 여기서 신청해도 사전예약 혜택 똑같이 받은건가요?,2017-05-01 18:12:42.950000
http://bbasak.com/bbs/board.php?bo_table=b001&wr_id=2169970&sfl=wr_subject%7C%7Cwr_content&stx=g6&sop=and&page=13,170412,G6 유플 이번주 평일 VS 주말 언제 타는게 좋을까요? 이번주 무조건 살려구요,기다리는 것도 쉽지 않아서 G6 유플로 이번주 무조건 탈려고 하는데 답은 없지만 이번주 주말에 뭔가 한번 올것 같기도 한 예감이 들어서요 이러다 반대로 지금 있는 조건도 주말부터 싹 사라질것 같기도 하고 참 어렵네요 ㅎㅎ 이번주 주말까지 관망하는게 좋을지 아님 이번주 평일에 타는게 좋을지 다른 분들 의견은 어떠세요?,2017-05-01 18:12:43.382000
http://bbasak.com/bbs/board.php?bo_table=b001&wr_id=2169216&sfl=wr_subject%7C%7Cwr_content&stx=g6&sop=and&page=13,170412,피말리네요 ㅋㅋ,빨리 졸업하고 싶네요 ㅋㅌㅂㅇ로 V20가려는데 계속 가격이 내리니까 계속 기다리게되고 ㅠㅠㅠ힘듭니다.ㅅㅋ는 좋던데,2017-05-01 18:12:44.614000
