http://bbasak.com/bbs/board.php?bo_table=b001&wr_id=2038098&sfl=wr_subject%7C%7Cwr_content&stx=g6&sop=and&page=18,17-03-03 18:33,g6 갤럭시s7엣지 비교하는데 s7이 역대급인가봐요 ㅎ,진짜 발표 날짜도 1년 정도로 딱 차이 나는데 스펙이 정말 s7이 떨어지는게 스냅 821하고 820차이 인데 이게 체감이 될지는 모르겠네요 배터리도 엣지가 더 많고 액정은 좀 더 작긴하더군요 운영체제도 어짜피 누가로 똑같고 삼성 한번 더 해주면 안드로이드 8번때 lg는 이제 상황 봐서 한번 업하면 똑같이 8번때 일거보면 ㅎㅎ g6가 가격이 s7보다 싸지 않는 이상 살이유가 없어 보이네요,333,2017-03-30 20:17:10.607000
http://bbasak.com/bbs/board.php?bo_table=b001&wr_id=2037753&sfl=wr_subject%7C%7Cwr_content&stx=g6&sop=and&page=18,17-03-03 17:13,U+ 기변으로 G6 생각중인데요~ 문의드립니다.,현재 데이터2.3 요금제로 실사용중인 직장인입니다. g6 예약구매는 해논상태이고 멤버쉽 혜택으로 공시지원 173000원으로 조회되는데 기존 출고가에 기변 혜택 및 실사용 요금제로 구입하는게 나을지 아니면 스노방 KT번이 조건이 나을지 계산이 힘드네요 전/후 어떤게 나을까요?,105,2017-03-30 20:17:10.771000
http://bbasak.com/bbs/board.php?bo_table=b001&wr_id=2037565&sfl=wr_subject%7C%7Cwr_content&stx=g6&sop=and&page=18,17-03-03 16:39,G6 예약 고민되게 만드네요,35징이라니...???? v20 이랑 가격 얼마 차이 없는 거 아닌가요,159,2017-03-30 20:17:10.992000
http://bbasak.com/bbs/board.php?bo_table=b001&wr_id=2037371&sfl=wr_subject%7C%7Cwr_content&stx=g6&sop=and&page=18,17-03-03 16:08,g6 나오며느hbs1100 중고나라ㅡ많이 풀리겠죠?,G6사기느느싫고ㅡ중고나라에서 사려고요,146,2017-03-30 20:17:11.180000
http://bbasak.com/bbs/board.php?bo_table=b001&wr_id=2037202&sfl=wr_subject%7C%7Cwr_content&stx=g6&sop=and&page=18,17-03-03 15:42,g2쓰는 사람입니다ㅠㅠg6예판 탈까요?,G2 쓰다가 다시는 엘지폰 안사야지 결심했었는데 또 흔들리네여 ㅎㅎㅎ G6 예판 35징이라니.. S8은 나와도 바로 못탈것 같아서요ㅠㅜ폭발할까봐요..,155,2017-03-30 20:17:11.421000
http://bbasak.com/bbs/board.php?bo_table=b001&wr_id=2037127&sfl=wr_subject%7C%7Cwr_content&stx=g6&sop=and&page=18,17-03-03 15:27,스노방 g6 SK 기변도 있나요?,v20 가야될지 G6 가야되지 심히 고민되는 하루네요.. G2로 한계가 느껴져서 쓰기도 힘들고..,125,2017-03-30 20:17:11.619000
http://bbasak.com/bbs/board.php?bo_table=b001&wr_id=2036843&sfl=wr_subject%7C%7Cwr_content&stx=g6&sop=and&page=18,17-03-03 14:26,요즘 ㅂㅇ가격대좀 알고 싶어요 ㅜㅜ,부모님 알뜰폰에서 번이좀 하려고 하는데 스노방 들어갈려면 한참 업해야하구.. 왠지 요즘이 s8 g6 i8 나오기 전이라 가격이 최고 좋을때 일것 같구... 가격대(최저 중간)만 알면 ㄱㅂ이던 ㅅㄷㄹ이던 직접가서 차이 별로 안나면 걍 지르게요 ㅜㅜ 효도폰으로 생각하는게 노트5나 갤7 갤a정도인데 이왕이면 저렴한 요금제로 안되면 고가요금제라도 유지기간 지나서 변경하더라도 가격좀 좀 자세하게(글쓰기 위반 같으면 쪽지로라도) 갈켜주시면 감사하겠습니다. 아~ 스노방이 어케 생겼는지?? ㅎ 궁금하네요;;,55,2017-03-30 20:17:11.780000
http://bbasak.com/bbs/board.php?bo_table=b001&wr_id=2036796&sfl=wr_subject%7C%7Cwr_content&stx=g6&sop=and&page=18,17-03-03 14:16,스노방 G6 사전예약 35징 이네요,Kt 65.8번이 부가2개 넣고 35징 입니다 참고하실분하세요 방금 보고왔어용 괜찮네요 이정도면,260,2017-03-30 20:17:11.982000
http://bbasak.com/bbs/board.php?bo_table=b001&wr_id=2036755&sfl=wr_subject%7C%7Cwr_content&stx=g6&sop=and&page=18,17-03-03 14:05,G6 서른징이면 괜찮은것 같기도하고..,사전예약 혜택이 1년액정무상 1회+정품케이스 거기다 HBS1100!! 이정도만해도 현금가 20은 넘을것같구요 거기다 스노방 번이30징.. 공시 7~10만 잡는다고 치면 뭐 이것저것 따져보면 할원2~30으로 잡힐것같은데 이정도면 괜찮은거 아닐까용?,213,2017-03-30 20:17:12.171000
http://bbasak.com/bbs/board.php?bo_table=b001&wr_id=2036707&sfl=wr_subject%7C%7Cwr_content&stx=g6&sop=and&page=18,17-03-03 13:57,스노방 G6 번이 예약 몇징정도 울리나요,정보좀 주세요~ Kt 랑 lg 번이 가능합니다,170,2017-03-30 20:17:12.365000
http://bbasak.com/bbs/board.php?bo_table=b001&wr_id=2036686&sfl=wr_subject%7C%7Cwr_content&stx=g6&sop=and&page=18,17-03-03 13:53,카메라 어떤것이 가장 좋을까요?,G6와 아이폰7 둘중 카메라 어떤게 더 좋을까요? (아니면 향후 나올 갤럭시8이 더 나을까요?),76,2017-03-30 20:17:12.551000
http://bbasak.com/bbs/board.php?bo_table=b001&wr_id=2036665&sfl=wr_subject%7C%7Cwr_content&stx=g6&sop=and&page=18,17-03-03 13:51,스노방에서 g6 예약판매 하나요???,노트7이랑은 달리 조용하네요 lg ㅠㅠㅠ,96,2017-03-30 20:17:12.745000
http://bbasak.com/bbs/board.php?bo_table=b001&wr_id=2036551&sfl=wr_subject%7C%7Cwr_content&stx=g6&sop=and&page=18,17-03-03 13:19,g6 사고싶군요,엘지쨔응,92,2017-03-30 20:17:12.919000
http://bbasak.com/bbs/board.php?bo_table=b001&wr_id=2036096&sfl=wr_subject%7C%7Cwr_content&stx=g6&sop=and&page=18,17-03-03 11:48,이번에 노트5 쓰면서 정말 소름끼치는거;,2월 개통 하고 펜 한번도 안 써봄; 달려있나 확인해보고는 꺼낸적이 없네요 배터리가 생각보다 광탈이고 (2년쓴 베가아이언2랑 맞먹게 빠짐) 노트5의 장점 (큰 화면)을 생각하면 결국 64G정도는 달아줘야 쓸만하다는거.. 가격말고는 큰 메리트 없습니다. 근데 가격이 모든걸 용서함.. 공시폭탄이여도 18개월만 버티자는 생각이면 괜찮음,710,2017-03-30 20:17:13.215000
http://bbasak.com/bbs/board.php?bo_table=b001&wr_id=2035467&sfl=wr_subject%7C%7Cwr_content&stx=g6&sop=and&page=18,17-03-03 08:41,칩셋 차이가 큰가요? G6 vs S8,지금 지프로2 쓰고 있는데 나름 만족하며 쓰고 있어요. 느린것도 없고 발열도 없고.. 폰을 몇번 떨어뜨려서 와이파이가 한번씩 끊기는거 말곤요. ㅎㅎ 이건 제 실수라... 이번에 g6로 갈지 한달 기다렸다 s8로 갈지 고민이네요. 디자인은 g6가 좋아보이고 여기 글 중에 칩셋차이는 무시못하는거 같은데.. 칩셋 올라감 어떤게 좋아지는 지는 안 나와 있어서요. 차이가 크게 남.. S8 살려고요,204,2017-03-30 20:17:13.432000
http://bbasak.com/bbs/board.php?bo_table=b001&wr_id=2035202&sfl=wr_subject%7C%7Cwr_content&stx=g6&sop=and&page=18,17-03-03 03:42,삼성이 835 칩셋을 생산하는것은 LG 에겐 불공정 게임,퀄컴과 삼성의 밀월관계가 하루이틀은 아니지만 삼성이 835 칩셋을만드는만큼 전세계에서 835 칩셋이 핸드폰에 장착될 최초의 모델이 S8 이 되겠죠. G6 가 S8 보다 먼저 835 칩셋을 달고 나와도 힘든 싸움인데 G6 는 삼성의 갑질에 어쩔 수 없이 821 칩셋을 담고 더 힘든 싸움을 해야하네요. 삼성은 엑시노스도 그런갑질을 했었죠. 자사제품에 최신 엑시노스 탑재를 하고 이후에 타회사에 판매를 했고 메이주는 이것에 빡쳐서 엑시노스와 절교선언하고 미디어텍으로 바꿔버렸죠. 그나저나 메이주는 저가라서 미디어텍에서 납품 받으면 되지만 LG 는 어디서 납품을 받는다죠? ...... 참 답이 안 나오는 싸움입니다.,256,2017-03-30 20:17:13.634000
http://bbasak.com/bbs/board.php?bo_table=b001&wr_id=2034754&sfl=wr_subject%7C%7Cwr_content&stx=g6&sop=and&page=18,17-03-02 23:54,갤S7 기기값 인하했네요.,이번 LG에서 나오는 G6가 잘 나와서 그런건가? 아님 S8 나오기 전에 떨이치는건지...? 이유는 모르겠지만 2월말에 S7 지르신 분들에게 위로를 전합니다. ㅠㅠ 토닥토닥,706,2017-03-30 20:17:13.961000
http://bbasak.com/bbs/board.php?bo_table=b001&wr_id=2034677&sfl=wr_subject%7C%7Cwr_content&stx=g6&sop=and&page=18,17-03-02 23:37,갠적으로 G6 기대중,ㅇㅈ?ㅇㅇㅈ?,156,2017-03-30 20:17:14.186000
http://bbasak.com/bbs/board.php?bo_table=b001&wr_id=2033898&sfl=wr_subject%7C%7Cwr_content&stx=g6&sop=and&page=18,17-03-02 20:34,G6 너무 짜네요..,V20 s7엣지에 비해서 나아진거라곤 디자인 하나뿐인거 같은데 30페이백이면 팔의지가 없는거 같네요..,333,2017-03-30 20:17:14.408000
http://bbasak.com/bbs/board.php?bo_table=b001&wr_id=2033474&sfl=wr_subject%7C%7Cwr_content&stx=g6&sop=and&page=18,17-03-02 18:38,스노방에 G6 있나요?,부모님 V20해드리려 했는데 좀 더 크기 작은 G6가 나은 것 같기도 하고... 지금 스노방에서 예약 받고있나요?ㅠ,207,2017-03-30 20:17:14.597000
http://bbasak.com/bbs/board.php?bo_table=b001&wr_id=2033370&sfl=wr_subject%7C%7Cwr_content&stx=g6&sop=and&page=18,17-03-02 18:05,g6와 v20 중 어느 것이 나을까요?,g6 예약판매 시작했는데요 가성비나 기타 조건 비교했을 때 v20와 g6 어느 것이 나을까요? 그리고 LG기변일 경우 v20 몇징이면 질러도 후회없을까요?,210,2017-03-30 20:17:14.801000
http://bbasak.com/bbs/board.php?bo_table=b001&wr_id=2033265&sfl=wr_subject%7C%7Cwr_content&stx=g6&sop=and&page=18,17-03-02 17:13,g6는 과연 성공할 것인가?,언더케이지 개봉기 보면 디자인은 일단 괜춘한거같은데..... 문데는 내부 스펙과 최적화 ㅠㅠ 근데 엘지 지금까지 행보를 보면 망삘인데ㅠㅠ,130,2017-03-30 20:17:15.047000
http://bbasak.com/bbs/board.php?bo_table=b001&wr_id=2032766&sfl=wr_subject%7C%7Cwr_content&stx=g6&sop=and&page=19,17-03-02 15:07,g6 체험단 되신분??,오늘이 당첨자 발표날인데 당첨되신분?? 메일로 오나요?? 문자로 오나요??,199,2017-03-30 20:17:15.533000
http://bbasak.com/bbs/board.php?bo_table=b001&wr_id=2032141&sfl=wr_subject%7C%7Cwr_content&stx=g6&sop=and&page=19,17-03-02 12:32,갤7 2만원됬네요,스크보니까 이제 59요금제개통하면 52만이던데 오징어만 타도 2만원이네요.. 겁나싸졌네욧 ㄷㄷ,1324,2017-03-30 20:17:15.828000
http://bbasak.com/bbs/board.php?bo_table=b001&wr_id=2030961&sfl=wr_subject%7C%7Cwr_content&stx=g6&sop=and&page=19,17-03-02 02:18,갤7 빵원 한달안에 올까요,어떻게 보시나요 ㅎㅎ,685,2017-03-30 20:17:16.126000
http://bbasak.com/bbs/board.php?bo_table=b001&wr_id=2030955&sfl=wr_subject%7C%7Cwr_content&stx=g6&sop=and&page=19,17-03-02 02:12,g6 공시 25정도에 오징이면 좋겠네요,이러면 고민은 해볼듯..,244,2017-03-30 20:17:16.352000
http://bbasak.com/bbs/board.php?bo_table=b001&wr_id=2030133&sfl=wr_subject%7C%7Cwr_content&stx=g6&sop=and&page=19,17-03-01 21:31,g6 스노방 나온거있나요?,이번에 잘나온거같은데 또 속는건아닌지..,174,2017-03-30 20:17:16.552000
http://bbasak.com/bbs/board.php?bo_table=b001&wr_id=2030121&sfl=wr_subject%7C%7Cwr_content&stx=g6&sop=and&page=19,17-03-01 21:25,G6 출고후 몇징 예상하시나요?,V20은 빠르게 오징 떠준긴 했는데 말이이죠,227,2017-03-30 20:17:16.731000
http://bbasak.com/bbs/board.php?bo_table=b001&wr_id=2028641&sfl=wr_subject%7C%7Cwr_content&stx=g6&sop=and&page=19,17-03-01 13:34,g6 vs 노트5,뭐살까여,207,2017-03-30 20:17:16.972000
http://bbasak.com/bbs/board.php?bo_table=b001&wr_id=2027633&sfl=wr_subject%7C%7Cwr_content&stx=g6&sop=and&page=19,17-03-01 08:01,언더케이지 g6 개봉기 떳네요,https://youtu.be/pgbcox_jQlg 언케 빠르네요,682,2017-03-30 20:17:17.255000
http://bbasak.com/bbs/board.php?bo_table=b001&wr_id=2027379&sfl=wr_subject%7C%7Cwr_content&stx=g6&sop=and&page=19,17-03-01 02:11,G6 언제쯤 여기 뜰까요?,G6 사려고 벼르고 있었는데 친구가 가입 절차가 까다로워졌다고 그래서 판매 개시일인 10일까지 활동 미리 해놓으려고 오늘 가입했는데 15일이나 걸려야 등업이 되네요. ㅠㅠㅠㅠㅠㅠㅠㅠㅠㅠㅠㅠㅠㅠㅠ 여기는 10일부터 뜰까요? 지금 폰이 맛이 가서 너무 힘들어요. 빨리 사야되는데... 운영진님 어떻게 안되나요... ㅠㅠㅠㅠㅠㅠㅠㅠ,137,2017-03-30 20:17:17.451000
http://bbasak.com/bbs/board.php?bo_table=b001&wr_id=2027074&sfl=wr_subject%7C%7Cwr_content&stx=g6&sop=and&page=19,17-02-28 23:41,요즘은 폰 뭐가 좋나요?,스노방은 거의 프리미엄급만 나오죠? 중저가는 별로 없는듯,123,2017-03-30 20:17:17.645000
http://bbasak.com/bbs/board.php?bo_table=b001&wr_id=2026699&sfl=wr_subject%7C%7Cwr_content&stx=g6&sop=and&page=19,17-02-28 21:35,g6 어떻게 생각하시나요???,저는 엘지폰 관심 없었는데 광고보고 혹했네요 디자인도 그렇고 화면 크기도 맘에 드네용ㅋㅋㅋ 다른 분들은 어떻게 생각하시나요??,179,2017-03-30 20:17:17.868000
http://bbasak.com/bbs/board.php?bo_table=b001&wr_id=2026647&sfl=wr_subject%7C%7Cwr_content&stx=g6&sop=and&page=19,17-02-28 21:20,기다리던 V20기변 요즘 좋아보이는데...,G6 보고 갑자기 망설여지내요.... V20은 갑자기 풀리내요 재고 떨이하나 ㅎ,199,2017-03-30 20:17:18.118000
http://bbasak.com/bbs/board.php?bo_table=b001&wr_id=2026299&sfl=wr_subject%7C%7Cwr_content&stx=g6&sop=and&page=19,17-02-28 19:33,g6출시되면 v20가격이 소폭이라도 하락할까요?,ㅇㅏ무래도 g6 반응이 중요하려나요,191,2017-03-30 20:17:18.351000
http://bbasak.com/bbs/board.php?bo_table=b001&wr_id=2025798&sfl=wr_subject%7C%7Cwr_content&stx=g6&sop=and&page=19,17-02-28 17:04,핸드폰 결정 장애중..,현재 고민되는 사안이 올해 12월에 약정기간이 끝나는데 위약금을 내더라도 갈아타는것이 맞는지에서 결정 장애가 있구요.. (벌써..) 만약 갈아탄다면 현재 나온 G6 / 아이폰7 / V20 이중에 뭘 타야되는지.. 혹은 올해 출시될 아이폰7S (바로 아이폰8으로 올라간다는 소문도 있고)이 제일 나을지 너무 고민됩니다. 어차피 12월에 약정기간이 만료되긴해서 기다려볼까도 생각중인데 노트3로 생활하기는 힘드네요.. 뭐가 좋을까요? ㅠㅠ,143,2017-03-30 20:17:18.586000
http://bbasak.com/bbs/board.php?bo_table=b001&wr_id=2025650&sfl=wr_subject%7C%7Cwr_content&stx=g6&sop=and&page=19,17-02-28 16:28,V20 기다리다가 결국 중고 구매로 졸업..,위약이 19 달려있었는데 조건들이 너무 안뜨더군요. 중고시세로 구매하는게 오히려 이득인 상황이라. 사은품 빼먹을꺼 다 빼먹은 단말기만 파는 것들중. 찾아보니 46이란 저렴한가격에 점심시간 나가서 U+발 V20 중고 가개통급 깨끗한놈 단말기만 업어왔습니다 SKT 폰이라 U+고객센터 앱이 거슬리긴하지만 다 잘되네요^^... 이렇게 졸업한적은 처음이라..... PS. G5후딱 팔아야지..,249,2017-03-30 20:17:18.788000
http://bbasak.com/bbs/board.php?bo_table=b001&wr_id=2025607&sfl=wr_subject%7C%7Cwr_content&stx=g6&sop=and&page=19,17-02-28 16:13,s7 출고가 인하정보?,근데 뉴스들이 조용해서..,415,2017-03-30 20:17:19.077000
http://bbasak.com/bbs/board.php?bo_table=b001&wr_id=2025581&sfl=wr_subject%7C%7Cwr_content&stx=g6&sop=and&page=19,17-02-28 16:05,G6 예판 정보,http://news.naver.com/main/read.nhn?mode=LSD&mid=sec&sid1=004&oid=123&aid=0002154296 예판 정보 기사 퍼옵니다. SKT가 제휴카드 할인이 제일 높다는군요 (50만 4천원),194,2017-03-30 20:17:19.253000
http://bbasak.com/bbs/board.php?bo_table=b001&wr_id=2025444&sfl=wr_subject%7C%7Cwr_content&stx=g6&sop=and&page=19,17-02-28 15:38,LG G6 SK텔레콤 전국매장과 온라인몰 동시 예약 판매,SK텔레콤이 다음달 2일부터 9일까지 전국 공식인증대리점과 T월드다이렉트를 통해 27일 LG전자가 공개한 'LG G6' 예약판매를 실시한다. 18대 9 화면 비율과 강화된 사운드 기능을 탑재했으며 출고가는 89만9800원으로 전국에 550여 개의 체험매장도 동시에 운영 소비자들이 직접 만져보고 선택할 수 있도록 했다. iKB국민카드로 기기할부금을 결제할 경우 캐시 백 6만원을 받을 수 있다. 전월 카드 사용실적이 30만 원 이상 70만 원 이상일 경우 각각 월 1만5천원 2만1천원을 카드 청구금액에서 할인해 준다. 24개월 동안 최대 50만4천원으로 업계 최고 할인금액이다. 구매 고객은 30개월 할부 조건으로 18개월 동안 보험료(월5천원)와 기기할부금을 납부한 이후 중고 폰을 반납하면 잔여 기기할부금 없이 새 스마트폰으로 교체해주는 프로그램인 프리미엄클럽에 가입할 수 있다. 이외에도 제조사 프로모션으로 예약 가입한 고객에게 정품케이스와 액정파손 1회 무료이용권을 제공하고 4월까지 개통한 고객에게 사은품 3종(선택1)과 추첨 경품을 지급할 예정이다. http://news.naver.com/main/read.nhn?mode=LSD&mid=sec&sid1=004&oid=123&aid=0002154296 기기 정면샷 디자인은 잘 빠진 거 같네요 아무래도 구글 넥서스폰을 너무 인상깊게 잘 썼기 때문에 제조를 담당했던 lg가 거기서 많은 팁을 건졌다는 얘길 들었는데...이번 제품에 대해서는 꽤나 호불호가 갈리는 듯 하네요 최대 50만 4천원이면 거진 가격은 40만 원대로 살 것 같은데 살짝 큰감이 없지 않죠?,130,2017-03-30 20:17:19.425000
http://bbasak.com/bbs/board.php?bo_table=b001&wr_id=2025237&sfl=wr_subject%7C%7Cwr_content&stx=g6&sop=and&page=19,17-02-28 14:51,내일 s7 출고가 인하한다 카더라...냉무,저는 좌,342,2017-03-30 20:17:19.689000
http://bbasak.com/bbs/board.php?bo_table=b001&wr_id=2023938&sfl=wr_subject%7C%7Cwr_content&stx=g6&sop=and&page=19,17-02-28 10:13,v20은 이제 물건도 안찍어내고 팔려는 생각도 없나봐요?,가격이 더 올랐네요..힐원이 10만원쯤 상승 조건도 안좋고 내일쯤 내방하려는데 사은품도 이제 없나요? v20 구매 힘드네요..... 더 기다려야하나요....,359,2017-03-30 20:17:19.992000
http://bbasak.com/bbs/board.php?bo_table=b001&wr_id=2022983&sfl=wr_subject%7C%7Cwr_content&stx=g6&sop=and&page=19,17-02-28 00:44,G6 출시,이로인해 핸폰가격이 좀 저렴해질까요 삼성8도 3월29일 출시된다는데,339,2017-03-30 20:17:20.276000
http://bbasak.com/bbs/board.php?bo_table=b001&wr_id=2021531&sfl=wr_subject%7C%7Cwr_content&stx=g6&sop=and&page=19,17-02-27 19:07,G6 어떻게 생각하세요??,음악을 자주 듣는데 고릴라글래스니 ap해서 이야기가 많아서 다른 분들은 어떻게 생각하시는지 궁금하네요.. 정확한 정보도 알고싶구요..네이ㅂ 댓글은 왠지 못 믿겠어요.. 어떻게 보시나요 g6 무한부팅은 브이공부턴 없다고 들었어요 사제케이블만 안쓰면 된다고 이번에는 상관없도록 수정했다고 뉴스에서 봤구요,182,2017-03-30 20:17:20.562000
http://bbasak.com/bbs/board.php?bo_table=b001&wr_id=2021202&sfl=wr_subject%7C%7Cwr_content&stx=g6&sop=and&page=19,17-02-27 17:27,LG G63월 10 일출시 한다네요,이번엔 좋게 나온거 같은데....,205,2017-03-30 20:17:20.808000
http://bbasak.com/bbs/board.php?bo_table=b001&wr_id=2020239&sfl=wr_subject%7C%7Cwr_content&stx=g6&sop=and&page=19,17-02-27 14:03,g6 예판혜택,1100 !!,206,2017-03-30 20:17:21.046000
http://bbasak.com/bbs/board.php?bo_table=b001&wr_id=2019873&sfl=wr_subject%7C%7Cwr_content&stx=g6&sop=and&page=19,17-02-27 12:50,G6 어떨까요 ...,이상하게 엘지에 정이 가요 디자인도 뭔가 개성있고 UX가 마음에 들고 해서.... 지금도 G4 쓰고 있는데 810대신 808 넣은 놈이라 지금 G6랑 겹쳐보이네요. 835대신 821이라... 음 근데 요즘 어차피 상향 평준화 되기도 했고 초고사양 게임도 잘 안해서 괜찮지 않을까 싶기도 하고 ㅎㅎ 음질은 v20 좋던데 그것보다 좋아졋다니 여기서 관심가고 화질도 돌비랑 HDR 적용됏대서 그것도 좋게 생각되고 근데 가격이 좀 ... ? 835도 아니고 램도 4기간데 얘네 뭔 배짱인지 모르겟네요. 출시하자마자 살까말까 고민되네요. 기다렸다 사는게 나을까요 아니면 걍 V20 갈까요,139,2017-03-30 20:17:21.263000
http://bbasak.com/bbs/board.php?bo_table=b001&wr_id=2019545&sfl=wr_subject%7C%7Cwr_content&stx=g6&sop=and&page=19,17-02-27 11:29,LG에서 2분기(6월쯤)에 플래그쉽 나온다는 소문도 있군요,G6의 상위버전 혹은 V30 G6 구매 예정자들을 망설이게 하는 소문이네요,156,2017-03-30 20:17:21.457000
http://bbasak.com/bbs/board.php?bo_table=b001&wr_id=2019435&sfl=wr_subject%7C%7Cwr_content&stx=g6&sop=and&page=19,17-02-27 10:49,요즘 대세 폰은 무엇인지요 ??ㅋㅋ,어떤폰에 대세인지 통 감이 안오네요 애플 / 삼성 이거뿐인지>>>>,185,2017-03-30 20:17:21.673000
http://bbasak.com/bbs/board.php?bo_table=b001&wr_id=2019289&sfl=wr_subject%7C%7Cwr_content&stx=g6&sop=and&page=19,17-02-27 10:13,G6 사려고 하는데,괜찮겠죠?,146,2017-03-30 20:17:21.867000
http://bbasak.com/bbs/board.php?bo_table=b001&wr_id=2019119&sfl=wr_subject%7C%7Cwr_content&stx=g6&sop=and&page=19,17-02-27 08:53,G6 괜찮을까요?,갤8 기다리고있는데 오늘 기사보니까 괜춘해보이기도 하네요 예전처럼 출시와함께 대란급으로 풀어주면ㅋ,175,2017-03-30 20:17:22.151000
http://bbasak.com/bbs/board.php?bo_table=b001&wr_id=2018860&sfl=wr_subject%7C%7Cwr_content&stx=g6&sop=and&page=19,17-02-27 01:35,g6 나오면 v20 가격이 떨어질까요?,v20 lg 기변 기다리는 일인입니다. 10일 g6 나오면 v20 가격 떨어질까요? lg 기변 너무 안나오네요.. 여기두 기다리시는 분 많은거 같은데요...,506,2017-03-30 20:17:22.444000
http://bbasak.com/bbs/board.php?bo_table=b001&wr_id=2018503&sfl=wr_subject%7C%7Cwr_content&stx=g6&sop=and&page=20,17-02-26 23:15,g6 잘됐으면..,순실전자의 독주보다는 lg와 좋은 경쟁을 했으면 합니다. g6대박 나길....,165,2017-03-30 20:17:22.988000
http://bbasak.com/bbs/board.php?bo_table=b001&wr_id=2018336&sfl=wr_subject%7C%7Cwr_content&stx=g6&sop=and&page=20,17-02-26 22:35,g6도 그냥..,오늘 발표했던데 그냥 v20이네요.. 일체형이 싫어서 아이폰 안쓰는데 방수방진한다고 일체여서 걍 v20 떨어지는거 기다려야겠네요,149,2017-03-30 20:17:23.189000
http://bbasak.com/bbs/board.php?bo_table=b001&wr_id=2018285&sfl=wr_subject%7C%7Cwr_content&stx=g6&sop=and&page=20,17-02-26 22:14,G6 카툭 보완은 결국 전체 뚱뚱으로 해결 했군요.,G5에도 카툭 있었고 V20에서는 몸통 더 얇아지면서 심하게 카툭. G6에서는 몸통을 카메라만큼 뚱뚱하게 해서 일자 몸매로 만들었군요 ㅋ (카메라 부분이 약간 얇아지기도 했지만) 몸통 뚱뚱으로 배터리 용량은 많이 늘었네요.,194,2017-03-30 20:17:23.375000
http://bbasak.com/bbs/board.php?bo_table=b001&wr_id=2018051&sfl=wr_subject%7C%7Cwr_content&stx=g6&sop=and&page=20,17-02-26 21:08,g6 생각보다ㅠ메리트가..,V20 싸게 나오면 그게 더 나을거같아요,249,2017-03-30 20:17:23.588000
http://bbasak.com/bbs/board.php?bo_table=b001&wr_id=2018023&sfl=wr_subject%7C%7Cwr_content&stx=g6&sop=and&page=20,17-02-26 21:03,이번 g6 이랑 s8이랑 경쟁해서 좋네요,그래도 독점 형태 보다는 경쟁하는 것이 소비자에겐 좋죠. G6괜찮은것 같지만 s8나오는거 봐서 맘 정해야 겠네요. 둘중 하날 사던 아니면 다른폰을 사던,256,2017-03-30 20:17:23.871000
http://bbasak.com/bbs/board.php?bo_table=b001&wr_id=2018001&sfl=wr_subject%7C%7Cwr_content&stx=g6&sop=and&page=20,17-02-26 20:58,LG G6 공식 스펙입니다,LG전자 홈페이지에서 캡쳐했어요,363,2017-03-30 20:17:24.203000
http://bbasak.com/bbs/board.php?bo_table=b001&wr_id=2017925&sfl=wr_subject%7C%7Cwr_content&stx=g6&sop=and&page=20,17-02-26 20:34,g6 발표하네요,공홈에도 사진떳고 유투브에서 발표영상 볼수있네요 베젤적어서 s7보다 화면이 정말크네요,291,2017-03-30 20:17:24.503000
http://bbasak.com/bbs/board.php?bo_table=b001&wr_id=2016695&sfl=wr_subject%7C%7Cwr_content&stx=g6&sop=and&page=20,17-02-26 14:15,s8 g6 발매앞두고 s7,공짜폰됐다고 뉴스떳네용 어디있을까용ㅋㅋ,232,2017-03-30 20:17:24.721000
http://bbasak.com/bbs/board.php?bo_table=b001&wr_id=2016694&sfl=wr_subject%7C%7Cwr_content&stx=g6&sop=and&page=20,17-02-26 14:15,15일 기다리기가 고역이네요ㅠㅠ,이제 하루지났는데...ㅠ 2주일이 큰 시간이어서 타이밍 놓칠까봐 걱정되네요ㅠ,90,2017-03-30 20:17:25.032000
http://bbasak.com/bbs/board.php?bo_table=b001&wr_id=2015274&sfl=wr_subject%7C%7Cwr_content&stx=g6&sop=and&page=20,17-02-26 02:00,G6언제 나오나요?,3월말에 나오나요?,109,2017-03-30 20:17:25.259000
http://bbasak.com/bbs/board.php?bo_table=b001&wr_id=2010810&sfl=wr_subject%7C%7Cwr_content&stx=g6&sop=and&page=20,17-02-24 22:45,v20  기다리는데....,v20 졸업준비중인데 g6 나오면 좀 떨어지겠죠ㅜㅜ 46번 왔을때 졸업을 못한게 후회되네요ㅜㅜ,165,2017-03-30 20:17:25.485000
http://bbasak.com/bbs/board.php?bo_table=b001&wr_id=2009636&sfl=wr_subject%7C%7Cwr_content&stx=g6&sop=and&page=20,17-02-24 17:38,G6 출시일이 언제? 가격?,G6에 관심이 있는데요. 언제쯤 국내에 나오나요? 그리고 가격이 90 넘을까요? 일단 출시되고 한달 지켜보는게 좋을까요?,61,2017-03-30 20:17:25.657000
http://bbasak.com/bbs/board.php?bo_table=b001&wr_id=2008936&sfl=wr_subject%7C%7Cwr_content&stx=g6&sop=and&page=20,17-02-24 14:41,G6 G5크기,화이트,108,2017-03-30 20:17:25.853000
