/board/view/?id=smartphone&no=4542978&page=2&search_pos=-4490000&s_type=search_all&s_keyword=g6,2017-03-26 11:49:36,G6이제 s8나오면 나가리 됨?,솔직히 G6끌리는데 가격 좀 팍팍 떨어지면 살거빨리 떨어져라ㅎ - dc official App,235,2017-04-03 21:57:42.721000
/board/view/?id=smartphone&no=4542972&page=2&search_pos=-4490000&s_type=search_all&s_keyword=g6,2017-03-26 11:23:33,요금납부 이런경우도있음???,미납금이 밀려서 당월요금 미납액을 내고서 통신사를 바꿈 미납액 60만원가량이 따라옴 고지서도 날아오고 근데 갑자기 전 통신사에서 요금 60만원가량 또내라함 이런경우 있던사람 있음? 오늘 g6개통하러 가는데 갑자기 미납금 60만원이있다함,67,2017-04-03 21:57:43.354000
/board/view/?id=smartphone&no=4542959&page=3&search_pos=-4490000&s_type=search_all&s_keyword=g6,2017-03-26 10:37:28,g6 상하단 언발란스라 병신 같기는 한데,지금까지는 가장 아름답고 잘 빠진 스마트폰임에는 틀림없다갤럭시s8 나오는 순간 또 찐따폰으로 전락하겠지만,253,2017-04-03 21:57:44.610000
/board/view/?id=smartphone&no=4542953&page=3&search_pos=-4490000&s_type=search_all&s_keyword=g6,2017-03-26 10:00:25,g6는 상하단배젤 비율만 맞췃어도..,ㅇㄹ,158,2017-04-03 21:57:45.275000
/board/view/?id=smartphone&no=4542949&page=3&search_pos=-4490000&s_type=search_all&s_keyword=g6,2017-03-26 08:50:41,g6 하단이 왜케 넓은가 했더니,lg마크 박을라고 그런거였네 ㅡ ㅡ,193,2017-04-03 21:57:45.870000
/board/view/?id=smartphone&no=4542946&page=3&search_pos=-4490000&s_type=search_all&s_keyword=g6,2017-03-26 08:26:21,휴포 알바들 많은듯,항상 같은 패턴 v20나올때도 그러고 g6나오면 또그러고,102,2017-04-03 21:57:46.566000
/board/view/?id=smartphone&no=4542931&page=3&search_pos=-4490000&s_type=search_all&s_keyword=g6,2017-03-26 02:00:03,근데 G6랑 S8이랑 너무 비슷한거같단 생각 안드냐,s8플랫이 G6인거같이존나똑같이생겼는데아무말없네,296,2017-04-03 21:57:47.245000
/board/view/?id=smartphone&no=4542923&page=3&search_pos=-4490000&s_type=search_all&s_keyword=g6,2017-03-26 01:32:52,s8 케이스 씌우면 되는데 개소리,너네 s7엣지 케이스 안봤지?디자인 그대로 살리면서 케이스로 무장시킨 거 있는데s8도 그런 거 나오겠지써보지도 않은 놈들이 욕질이더라아마 그런 케이스 씌우면 고릴라글래스5인 s8이 고릴라글래스3인 g6보다 더 안박살난다,155,2017-04-03 21:57:47.873000
/board/view/?id=smartphone&no=4542921&page=3&search_pos=-4490000&s_type=search_all&s_keyword=g6,2017-03-26 01:26:06,스마트폰 갤러리 '공식' 추천폰 . txt,1. 플래그쉽 부문 - G6맛갤 공식 현존 최강폰 예쁜디자인에 좋은기본기에다가 수백만원짜리 '음감 전용기기' 쳐바르는 가성비를 보여준다2. 보급형 부문 - galaxy a5 2017보급형 주제에 14nm AP를 탑재한 사기템3. 중고폰 부문 - g5스냅 820 주제에 중고가 20만원 안팎 - dc official App,232,2017-04-03 21:57:48.406000
/board/view/?id=smartphone&no=4542920&page=3&search_pos=-4490000&s_type=search_all&s_keyword=g6,2017-03-26 01:24:52,V20 G6 헛소문 논파 . txt,1. 고음질 mp3나 flac을 안쓰면 효과가 없다? ㄴㄴ 업샘플링 개념도 모르는 음알못이 퍼뜨리는 헛소리 저음질+스트리밍해도 엄청난 음질향상 효과가 있다 2. 좋은 이어폰을 안쓰면 효과가 없다? ㄴㄴ 번들로도 충분히 입체감 노이즈제거 등등 효과를 볼수있다 3. 몇몇 황금귀만 구분할수 있다? ㄴㄴ 막귀도 한번 들려주면 확실히 차이를 느낀다 4. dac 업그레이드는 음악듣는데에 효과가 별로 없다? ㄴㄴ dac 업그레이든 음질 향상에 이어폰 다음으로 효과가 크다 이어폰>>DAC>>>>>>>>>>>음원>>>>기타잡 이게 정석이다 - dc official App,153,2017-04-03 21:57:48.940000
/board/view/?id=smartphone&no=4542918&page=3&search_pos=-4490000&s_type=search_all&s_keyword=g6,2017-03-26 01:19:41,스마트폰 갤러리 선정 3대 혁신 . txt,1. 14/16나노공정 AP 핀펫구조로 전공정보다 동일성능에서 전력소모 60% 감소 최대 성능 80% 증가 2. 플랫디자인 ios 플랫디자인이든 안드로이드 머티리얼이든 이 디자인 적용되기 전에 폰들보면 전부 다 장난감같은 인터페이스였음 이거 없었으면 지금도 장난감같은 인터페이스 썼을듯 3. LG 하이파이 LG 하이파이 플러스 v20  v10 G6 전부 수백만원짜리 전문기기 처바르는 음질을 들려줌 샤오미 원플러스 이런회사가 혜자가 아니라 LG가 진정한 혜자 - dc official App,231,2017-04-03 21:57:49.636000
/board/view/?id=smartphone&no=4542904&page=3&search_pos=-4490000&s_type=search_all&s_keyword=g6,2017-03-26 00:56:09,일반 320쩌리 mp3도 v20이나 g6로 들으면 좋냐,,166,2017-04-03 21:57:50.305000
/board/view/?id=smartphone&no=4542903&page=3&search_pos=-4490000&s_type=search_all&s_keyword=g6,2017-03-26 00:51:02,G6나 s8이나 씹좃못이네,걍 아예 전면 스크린 할거 아니면 적당히 베젤있는게 나아보임;;,138,2017-04-03 21:57:51.034000
/board/view/?id=smartphone&no=4542901&page=3&search_pos=-4490000&s_type=search_all&s_keyword=g6,2017-03-26 00:42:59,G6 추하다.....,뭔가 베끼다 만 3류 짱깨폰 같다.....어찌함 ㅋㅋㅋㅋㅋㅋㅋ,273,2017-04-03 21:57:51.698000
/board/view/?id=smartphone&no=4542900&page=3&search_pos=-4490000&s_type=search_all&s_keyword=g6,2017-03-26 00:42:02,G6 V20 음질 약간이나마 체험하는 방법 . txt,컴퓨터에 viper4windows 설치하고 music mode에서 viper xclarity ㅡ xhifi 키라구 V20 G6에 비하면 미세하지만 잡음 없어지고 음질이 단단해진다구 - dc official App,107,2017-04-03 21:57:52.234000
/board/view/?id=smartphone&no=4542898&page=3&search_pos=-4490000&s_type=search_all&s_keyword=g6,2017-03-26 00:38:39,G6 V20이 독보적으로 가성비가 좋은 이유 . txt,리시버나 음원은 가성비 좋은게 많지만 dac는 가성비 좋은건 LG 하이파이 V20 G6 뿐이기 때문리시버 가성비 목록 ㅡ 쿼드비트3 ksc75 애플 인이어 등등음원 가성비 목록 ㅡ 멜론 등등하지만 dac는??LG 하이파이 V20 G6 세개뿐 - dc official App,106,2017-04-03 21:57:52.777000
/board/view/?id=smartphone&no=4542897&page=3&search_pos=-4490000&s_type=search_all&s_keyword=g6,2017-03-26 00:38:10,G6 장점 . txt,LCD 대화면 예쁜 디자인 화질 좋은 광각 카메라 방수 좋은 기본기 AS 러기드폰임 수백만원짜리 '음감 전문기기' 처바르는 음질 ㄷㄷㄷㄷㄷㄷㄷㄷㄷ - dc official App,117,2017-04-03 21:57:53.441000
/board/view/?id=smartphone&no=4542896&page=3&search_pos=-4490000&s_type=search_all&s_keyword=g6,2017-03-26 00:34:08,LG G6에 들어간 스냅드래곤 821가 좋은 이유 . txt,1. 전력소모가 낮다 3월 14일자 아난드택 측정결과 스냅821의 전력소모는 4.7w로 엄청나게 적은 전력소모를 자랑한다구 2. 긱벤치4의 모함 원래 긱벤치3에서 싱글 2300이 나오는 엄청난 ap였으나 긱벤치4가 나오고 나서 저평가를 받는다구 3. gpu가 좋다구 애플은 아키텍쳐 개선없이 클럭올림 ㅡ 쓰로틀링 작렬 삼성은 말레기사용 ㅡ 쓰로틀링작렬 하지만 스냅821은 쓰로틀링없는 gpu를 사용하는 현존 최강의 ap라구 ap때문에 현존 최강폰 G6를 안사는 멍청한짓은 하지 않도록 하자구 (≥∀≤)/ - dc official App,250,2017-04-03 21:57:53.967000
/board/view/?id=smartphone&no=4542893&page=3&search_pos=-4490000&s_type=search_all&s_keyword=g6,2017-03-26 00:29:36,각 회사별 레전드 기기 . txt,삼성 ㅡ 갤럭시 s2애플 ㅡLG ㅡ G6애플은 원래 애플 인이어 있었는데 정전기 너무 심해서 탈락시켰다구 - dc official App,157,2017-04-03 21:57:54.574000
/board/view/?id=smartphone&no=4542887&page=3&search_pos=-4490000&s_type=search_all&s_keyword=g6,2017-03-26 00:19:54,g6가 v20보다 카메라 구리지?,구글에서 g6 vs v20 카메라 동영상 보면 v20이 초점 더 빨리 맞추네디자인 아니면 v20 가는 게 답인가,77,2017-04-03 21:57:55.225000
/board/view/?id=smartphone&no=4542884&page=3&search_pos=-4490000&s_type=search_all&s_keyword=g6,2017-03-26 00:08:57,g6 17만원 어디냐 ,빨리 좌표불러줘.. - dc official App,81,2017-04-03 21:57:55.925000
/board/view/?id=smartphone&no=4542881&page=3&search_pos=-4490000&s_type=search_all&s_keyword=g6,2017-03-25 23:58:22,g6 유저 있냐??,원래 5.7인치에 18:9 잖아?그러면 소프트키 뺀 부분의 화면 크기랑 화면비율이 어떻게 되냐?,121,2017-04-03 21:57:56.469000
/board/view/?id=smartphone&no=4542879&page=4&search_pos=-4490000&s_type=search_all&s_keyword=g6,2017-03-25 23:40:52,v20이 g6보다 좋은 점이 뭐가 있냐? 없지?,v20 쓰레기된건가?,116,2017-04-03 21:57:57.602000
/board/view/?id=smartphone&no=4542876&page=4&search_pos=-4490000&s_type=search_all&s_keyword=g6,2017-03-25 23:34:37,g6 땡긴다...,소프트키 싫어하지만2:1 비율 5.7인치니까소프트키 빼도 5.3인치는 되지 않을까 기대중(소프트키 뺀 비율이랑 화면크기 알면 알려주삼!)배터리도 탈착식을 원하지만ip68 버프 받고 참아주기로 함헬지 전면로고도 완전 싫지만(샘숭은 플래그십에선 전면로고 빼기 시작)얘네도 이걸 아는지 최근 플래그십에선흐릿하게 바꿈ㅋㅋ지금 쓰고있는베가아이언2 아몰레드인 점이랑마쉬멜로에서 멈춰있지만 않으면계속 쓸 텐데 좀 아쉽네...결론은 요즘 g6 얼마나 하냐?,75,2017-04-03 21:57:58.165000
/board/view/?id=smartphone&no=4542866&page=4&search_pos=-4490000&s_type=search_all&s_keyword=g6,2017-03-25 23:03:08,킹갓 디자인 g6은 v20보단 훨 낫지만,"89만원 주고 g6을 사느니 리팩에서 ""단돈"" 39만원이면 살 수 있는 세젤예 킹갓 디자인 z11 제로베젤을 선택하는게 맞다구",167,2017-04-03 21:57:58.832000
/board/view/?id=smartphone&no=4542851&page=4&search_pos=-4490000&s_type=search_all&s_keyword=g6,2017-03-25 22:23:36,39만원 z11 제로베젤 vs 89만원 g6,둘 다 킹갓 디자인이지만 이건 너무하지 않나 싶다구. 알아서 선택하라구,122,2017-04-03 21:57:59.645000
/board/view/?id=smartphone&no=4542805&page=4&search_pos=-4490000&s_type=search_all&s_keyword=g6,2017-03-25 20:19:16,g6 기변 가격 쭉 이럼?,앞으로도 이렇게 팔 예정?,186,2017-04-03 21:58:00.176000
/board/view/?id=smartphone&no=4542803&page=4&search_pos=-4490000&s_type=search_all&s_keyword=g6,2017-03-25 20:16:52,매장가서 g6만지고왔다 장점정리해준다,번이17,233,2017-04-03 21:58:00.719000
/board/view/?id=smartphone&no=4542802&page=4&search_pos=-4490000&s_type=search_all&s_keyword=g6,2017-03-25 20:15:42,약정남았는데 g6로 번이하면 위약금 무나요?,kt인데 번이 25보고 혹해서 알아보는중인데 어떤가요,130,2017-04-03 21:58:01.250000
/board/view/?id=smartphone&no=4542789&page=4&search_pos=-4490000&s_type=search_all&s_keyword=g6,2017-03-25 19:39:46,[뉴비필독] 스마트폰 갤러리 '오피셜' 추천폰,1. 플래그쉽 부문 - G6맛갤 공식 현존 최강폰 예쁜디자인에 좋은기본기에다가 수백만원짜리 '음감 전용기기' 쳐바르는 가성비를 보여준다2. 보급형 부문 - galaxy a5 2017보급형 주제에 14nm AP를 탑재한 사기템3. 중고폰 부문 - g5스냅 820 주제에 중고가 20만원 안팎 - dc official App,176,2017-04-03 21:58:01.970000
/board/view/?id=smartphone&no=4542752&page=4&search_pos=-4490000&s_type=search_all&s_keyword=g6,2017-03-25 16:35:31,매일 삼성 까는 놈 왜 괜히 g6 s8 욕하냐,어차피 이지모바일 7천원 요금제 쓰는 좆찐따 새끼라 만져보지도 못할 g6 s8 까고 있음?진짜 사서 잘 쓰는 사람들 다 알아서 잘 쓸텐데 쓰기는커녕 만져보지도 못할 좆찐따가 왜 g6 s8 까는걸까그냥 홍미4x 미맥스 쓰면서 s8 g6보다 좋다고 자위나 해라,261,2017-04-03 21:58:02.539000
/board/view/?id=smartphone&no=4542745&page=4&search_pos=-4490000&s_type=search_all&s_keyword=g6,2017-03-25 16:22:56,G6 장점 FACT,번이 20,172,2017-04-03 21:58:03.223000
/board/view/?id=smartphone&no=4542743&page=4&search_pos=-4490000&s_type=search_all&s_keyword=g6,2017-03-25 16:20:29,G6 장점 알려드릴게요 살떄 도움되시길,없음,104,2017-04-03 21:58:03.926000
/board/view/?id=smartphone&no=4542739&page=4&search_pos=-4490000&s_type=search_all&s_keyword=g6,2017-03-25 16:02:32,어처피 갤8이던 g6던비싸서 못사는놈들이 까긴존나까네요;;,ㅉ - dc official App,106,2017-04-03 21:58:04.793000
/board/view/?id=smartphone&no=4542732&page=4&search_pos=-4490000&s_type=search_all&s_keyword=g6,2017-03-25 15:33:06,G6 산지 보름정도 됐는데 약간 후회된다,장점 ㅡ 음질 디자인단점 ㅡ 터치감 사이즈아이폰5s 2년 쓰다 넘어와서 성능은 최신폰이면 거의 만족내가 손이 작아서 아이폰5 사이즈가 딱 좋았는데 막상 못느끼다가 이번에 큰폰 쓰게 되니깐 확 느껴진다한손으로 못다루겠다 이게 생각보다 엄청 불편하네터치감은 개취 문제 일수도 있는데 난 아무래도 아이폰 터치감이 좋다디자인은 안드로이드 폰중에선 제일 괜찮다다른폰은 디자인에서 다 걸렀는데 이게 그나마 젤 괜찮다음질은 와우 대박사은품은 하이파이 안되는줄 알았으면 안했을 톤플러스돌채구스토 머신이나 할껄,248,2017-04-03 21:58:05.568000
/board/view/?id=smartphone&no=4542725&page=4&search_pos=-4490000&s_type=search_all&s_keyword=g6,2017-03-25 14:57:00,G6데모만 보고 방금 실물도 봤는데,진짜 어딜봐서 이쁘단건지 모르겠다기본적으로 폰이 너무 졋만한 느낌,177,2017-04-03 21:58:06.270000
/board/view/?id=smartphone&no=4542714&page=4&search_pos=-4490000&s_type=search_all&s_keyword=g6,2017-03-25 13:50:55,동네 집앞 공식대리점에서 폰 사는 행위는 비추야??,g6 살려고 하는데 가족 통신사가 다 lg라 거서 사려고 하거든..u+샵? 암튼 유플간판만 딱 달고 장사하는곳 있잖아 그런곳에서 사는거 어때?,148,2017-04-03 21:58:08.304000
/board/view/?id=smartphone&no=4542699&page=4&search_pos=-4490000&s_type=search_all&s_keyword=g6,2017-03-25 12:59:18,중국폰 쓰는 애들이 비싸다느니 삼성 엘지 욕하더라,어차피 s8도 g6도 못사는 무능력자 주제에 ㅋㅋㅋ,113,2017-04-03 21:58:08.893000
/board/view/?id=smartphone&no=4542696&page=4&search_pos=-4490000&s_type=search_all&s_keyword=g6,2017-03-25 12:51:18,G6 카메라 유리 기스 왜이렇게 잘나냐,나름 만족하며 쓰고 있는데 카메라쪽 유리 기스난거 존나 신경쓰이네. 생폰쓰면 원래이러냐,166,2017-04-03 21:58:09.424000
/board/view/?id=smartphone&no=4542690&page=4&search_pos=-4490000&s_type=search_all&s_keyword=g6,2017-03-25 12:30:42,G6 V20이 최강인 이유 . txt,리시버나 음원은 가성비 좋은게 많지만 dac는 가성비 좋은건 LG 하이파이 V20 G6 뿐이기 때문리시버 가성비 목록 ㅡ 쿼드비트3 ksc75 애플 인이어 등등음원 가성비 목록 ㅡ 멜론 등등하지만 dac는??LG 하이파이 V20 G6 세개뿐 - dc official App,133,2017-04-03 21:58:10.012000
/board/view/?id=smartphone&no=4542689&page=4&search_pos=-4490000&s_type=search_all&s_keyword=g6,2017-03-25 12:30:07,G6장점 . txt,LCD 대화면 예쁜 디자인 화질 좋은 광각 카메라 방수 좋은 기본기 AS 러기드폰임 수백만원짜리 '음감 전문기기' 처바르는 음질 ㄷㄷㄷㄷㄷㄷㄷㄷㄷ - dc official App,219,2017-04-03 21:58:10.629000
/board/view/?id=smartphone&no=4542688&page=4&search_pos=-4490000&s_type=search_all&s_keyword=g6,2017-03-25 12:29:49,G6에 들어간 스냅드래곤 821가 좋은 이유 . txt,1. 전력소모가 낮다 3월 14일자 아난드택 측정결과 스냅821의 전력소모는 4.7w로 엄청나게 적은 전력소모를 자랑한다구 2. 긱벤치4의 모함 원래 긱벤치3에서 싱글 2300이 나오는 엄청난 ap였으나 긱벤치4가 나오고 나서 저평가를 받는다구 3. gpu가 좋다구 애플은 아키텍쳐 개선없이 클럭올림 ㅡ 쓰로틀링 작렬 삼성은 말레기사용 ㅡ 쓰로틀링작렬 하지만 스냅821은 쓰로틀링없는 gpu를 사용하는 현존 최강의 ap라구 ap때문에 현존 최강폰 G6를 안사는 멍청한짓은 하지 않도록 하자구 (≥∀≤)/ - dc official App,164,2017-04-03 21:58:11.314000
/board/view/?id=smartphone&no=4542685&page=5&search_pos=-4490000&s_type=search_all&s_keyword=g6,2017-03-25 12:28:57,스마트폰 갤러리 '공식' 추천폰,1. 플래그쉽 부문 - G6맛갤 공식 현존 최강폰 예쁜디자인에 좋은기본기에다가 수백만원짜리 '음감 전용기기' 쳐바르는 가성비를 보여준다2. 보급형 부문 - galaxy a5 2017보급형 주제에 14nm AP를 탑재한 사기템3. 중고폰 부문 - g5스냅 820 주제에 중고가 20만원 안팎 - dc official App,142,2017-04-03 21:58:12.541000
/board/view/?id=smartphone&no=4542684&page=5&search_pos=-4490000&s_type=search_all&s_keyword=g6,2017-03-25 12:28:39,스마트폰 갤러리 선정 3대 혁신 . txt,1. 14/16나노공정 AP 핀펫구조로 전공정보다 동일성능에서 전력소모 60% 감소 최대 성능 80% 증가 2. 플랫디자인 ios 플랫디자인이든 안드로이드 머티리얼이든 이 디자인 적용되기 전에 폰들보면 전부 다 장난감같은 인터페이스였음 이거 없었으면 지금도 장난감같은 인터페이스 썼을듯 3. LG 하이파이 LG 하이파이 플러스 v20  v10 G6 전부 수백만원짜리 전문기기 처바르는 음질을 들려줌 샤오미 원플러스 이런회사가 혜자가 아니라 LG가 진정한 혜자 - dc official App,124,2017-04-03 21:58:13.087000
/board/view/?id=smartphone&no=4542677&page=5&search_pos=-4490000&s_type=search_all&s_keyword=g6,2017-03-25 12:04:35,g6거르고 v30 각재야겟다,v10 존나 만족스럽게 썼다,113,2017-04-03 21:58:13.645000
/board/view/?id=smartphone&no=4542661&page=5&search_pos=-4490000&s_type=search_all&s_keyword=g6,2017-03-25 10:09:11,g6폰비율바껴도 동셩상볼때 상관없나?,그냥 다운받아서보는것들 비율은에케맞쳐진거지양옆 검정색으로채우나 아님 늘리나 늘리면비율좀안이상하려나,127,2017-04-03 21:58:14.239000
/board/view/?id=smartphone&no=4542659&page=5&search_pos=-4490000&s_type=search_all&s_keyword=g6,2017-03-25 09:59:18,ㅋㅋ 톤플 12만원에팔았다,중고나라가보니까 g6톤플 물량 존나많던데 ㅋㅋㅋㅋㅋ조금만더있으면 5만원까지도 떨어질듯.. 일찍팔아서다행이다 - dc official App,91,2017-04-03 21:58:14.881000
/board/view/?id=smartphone&no=4542658&page=5&search_pos=-4490000&s_type=search_all&s_keyword=g6,2017-03-25 09:58:56,"
언더케이지 g6음향리뷰 떴다",ㅇㅇhttps://youtu.be/zQ7PIzjh9HM,203,2017-04-03 21:58:15.600000
/board/view/?id=smartphone&no=4542639&page=5&search_pos=-4490000&s_type=search_all&s_keyword=g6,2017-03-25 04:15:48,디시위키 수정하느라 개 피곤하내...,g6찬양글 너무 믿지말고 살땐 꼭 확인하고 사라 - dc official App,90,2017-04-03 21:58:16.225000
/board/view/?id=smartphone&no=4542632&page=5&search_pos=-4490000&s_type=search_all&s_keyword=g6,2017-03-25 02:05:32,비율은 그대로고 크기를죽일 수는 없는거냐?,g6 s8크기를 작게 하면 좋은데 배터리 때문에 일부러 길쭉한 스마트폰 만듦?,96,2017-04-03 21:58:16.951000
/board/view/?id=smartphone&no=4542631&page=5&search_pos=-4490000&s_type=search_all&s_keyword=g6,2017-03-25 02:04:17,화면 커서 좋은 점은 동영상 보기인데 g6나 s8은 이점이 있냐?,비율 장애라서어차피 화면 잘려서 나오잖아이거 뭔 의미인지 모르겄네,185,2017-04-03 21:58:17.585000
/board/view/?id=smartphone&no=4542622&page=5&search_pos=-4490000&s_type=search_all&s_keyword=g6,2017-03-25 00:49:40,그래서 g6 번들로 들으면 어느정도 수준인데?,응?,113,2017-04-03 21:58:18.335000
/board/view/?id=smartphone&no=4542621&page=5&search_pos=-4490000&s_type=search_all&s_keyword=g6,2017-03-25 00:48:59,이새끼들 g6빨아주는거 비꼬는거맞지,거르면되지?,84,2017-04-03 21:58:18.906000
/board/view/?id=smartphone&no=4542609&page=5&search_pos=-4490000&s_type=search_all&s_keyword=g6,2017-03-25 00:22:44,G6가 낫나여 아이폰7+가 낫나여,ㅈㄱㄴ,187,2017-04-03 21:58:19.633000
/board/view/?id=smartphone&no=4542552&page=5&search_pos=-4490000&s_type=search_all&s_keyword=g6,2017-03-24 21:19:38,g6 블루투스는 하이파이안되냐?,톤플러스 왔길래 들어보려했는데 하이파이안되네 씨발;;번들이어폰이 훨났다 바로 판다 - dc official App,126,2017-04-03 21:58:20.352000
/board/view/?id=smartphone&no=4542521&page=5&search_pos=-4490000&s_type=search_all&s_keyword=g6,2017-03-24 19:39:43,각 회사별 레전드급 기기 . txt,삼성 ㅡ 갤럭시 s2애플 ㅡLG ㅡ G6애플은 원래 애플 인이어 있었는데 정전기 너무 심해서 탈락시켰다구 - dc official App,247,2017-04-03 21:58:20.945000
/board/view/?id=smartphone&no=4542502&page=5&search_pos=-4490000&s_type=search_all&s_keyword=g6,2017-03-24 18:53:06,G6 V20이 쩌는 이유 . real,리시버나 음원은 가성비 좋은게 많지만 dac는 가성비 좋은건 LG 하이파이 V20 G6 뿐이기 때문리시버 가성비 목록 ㅡ 쿼드비트3 ksc75 애플 인이어 등등음원 가성비 목록 ㅡ 멜론 등등하지만 dac는??LG 하이파이 V20 G6 세개뿐 - dc official App,184,2017-04-03 21:58:21.505000
/board/view/?id=smartphone&no=4542494&page=5&search_pos=-4490000&s_type=search_all&s_keyword=g6,2017-03-24 18:33:59,G6에 들어간 스냅드래곤 821가 좋은 이유 . txt,1. 전력소모가 낮다 3월 14일자 아난드택 측정결과 스냅821의 전력소모는 4.7w로 엄청나게 적은 전력소모를 자랑한다구 2. 긱벤치4의 모함 원래 긱벤치3에서 싱글 2300이 나오는 엄청난 ap였으나 긱벤치4가 나오고 나서 저평가를 받는다구 3. gpu가 좋다구 애플은 아키텍쳐 개선없이 클럭올림 ㅡ 쓰로틀링 작렬 삼성은 말레기사용 ㅡ 쓰로틀링작렬 하지만 스냅821은 쓰로틀링없는 gpu를 사용하는 현존 최강의 ap라구 ap때문에 현존 최강폰 G6를 안사는 멍청한짓은 하지 않도록 하자구 (≥∀≤)/ - dc official App,207,2017-04-03 21:58:22.042000
/board/view/?id=smartphone&no=4542489&page=5&search_pos=-4490000&s_type=search_all&s_keyword=g6,2017-03-24 18:29:21,G6 장점 . txt,LCD 대화면 예쁜 디자인 화질 좋은 광각 카메라 방수 좋은 기본기 AS 러기드폰임 수백만원짜리 '음감 전문기기' 처바르는 음질 ㄷㄷㄷㄷㄷㄷㄷㄷㄷ - dc official App,131,2017-04-03 21:58:22.766000
/board/view/?id=smartphone&no=4542485&page=5&search_pos=-4490000&s_type=search_all&s_keyword=g6,2017-03-24 18:25:01,스마트폰 갤러리 '공식' 추천폰,1. 플래그쉽 부문 - G6맛갤 공식 현존 최강폰 예쁜디자인에 좋은기본기에다가 수백만원짜리 '음감 전용기기' 쳐바르는 가성비를 보여준다2. 보급형 부문 - galaxy a5 2017보급형 주제에 14nm AP를 탑재한 사기템3. 중고폰 부문 - g5스냅 820 주제에 중고가 20만원 안팎 - dc official App,121,2017-04-03 21:58:23.456000
/board/view/?id=smartphone&no=4542484&page=5&search_pos=-4490000&s_type=search_all&s_keyword=g6,2017-03-24 18:21:38,스마트폰 갤러리 선정 3대 혁신 . real,1. 14/16나노공정 AP 핀펫구조로 전공정보다 동일성능에서 전력소모 60% 감소 최대 성능 80% 증가 2. 플랫디자인 ios 플랫디자인이든 안드로이드 머티리얼이든 이 디자인 적용되기 전에 폰들보면 전부 다 장난감같은 인터페이스였음 이거 없었으면 지금도 장난감같은 인터페이스 썼을듯 3. LG 하이파이 LG 하이파이 플러스 v20  v10 G6 전부 수백만원짜리 전문기기 처바르는 음질을 들려줌 샤오미 원플러스 이런회사가 혜자가 아니라 LG가 진정한 혜자 - dc official App,123,2017-04-03 21:58:24.003000
/board/view/?id=smartphone&no=4542455&page=5&search_pos=-4490000&s_type=search_all&s_keyword=g6,2017-03-24 16:27:11,이거 좀 봐줘 폰잘알들아,sk번이 노트5 ㅎㅇ 15kt번이 g5 ㅎㅇ 7 g6 ㅎㅇ45 v20 ㅎㅇ 42lg번이 노트5 ㅎㅇ 15 갤7 ㅎㅇ 22어떤게ㅡ젤 나음?,185,2017-04-03 21:58:24.745000
/board/view/?id=smartphone&no=4542454&page=6&search_pos=-4490000&s_type=search_all&s_keyword=g6,2017-03-24 16:27:06,강변 가서 사려는데,번이 로 생각중인데s7 시세 어떠냐s7 번이 갈바에 g6가 낫나? - dc official App,81,2017-04-03 21:58:25.833000
/board/view/?id=smartphone&no=4542434&page=6&search_pos=-4490000&s_type=search_all&s_keyword=g6,2017-03-24 15:02:10,g6 카드 없이 얼마까지 되냐 30미만 되나?,제발 ㅠ,78,2017-04-03 21:58:26.520000
/board/view/?id=smartphone&no=4542428&page=6&search_pos=-4490000&s_type=search_all&s_keyword=g6,2017-03-24 14:32:34,g6 싸게사는곳좀 알려줘라.,g6 싸게사는곳좀 알려줘라.어디가야 해?,84,2017-04-03 21:58:27.052000
/board/view/?id=smartphone&no=4542422&page=6&search_pos=-4490000&s_type=search_all&s_keyword=g6,2017-03-24 14:15:31,스마트폰 사려고 하는데 G6이 좋을까 아이폰7이 좋을까?,스마트폰 사려고 하는데 G6이 좋을까 아이폰7이 좋을까?그리고 어디가야 싸냐? 정보 좀,91,2017-04-03 21:58:27.661000
